skill,suggestion,link
python,"""Build automation scripts, APIs  and data projects""",https://www.google.com/search?q=python%20tutorial
java,Practice OOP concepts and backend systems,https://www.google.com/search?q=java%20tutorial
c++,Focus on data structures and system-level programming,https://www.google.com/search?q=c%2B%2B%20tutorial
c,Learn memory management and embedded basics,https://www.google.com/search?q=c%20tutorial
javascript,Master async programming and DOM manipulation,https://www.google.com/search?q=javascript%20tutorial
typescript,Learn type safety and scalable frontend apps,https://www.google.com/search?q=typescript%20tutorial
go,Build high-performance backend services,https://www.google.com/search?q=go%20tutorial
rust,Learn safe systems programming and performance optimization,https://www.google.com/search?q=rust%20tutorial
html,Create semantic and accessible web pages,https://www.google.com/search?q=html%20tutorial
css,Practice responsive design and layouts,https://www.google.com/search?q=css%20tutorial
sass,Learn modular CSS and variables,https://www.google.com/search?q=sass%20tutorial
bootstrap,Build responsive UI quickly,https://www.google.com/search?q=bootstrap%20tutorial
tailwind,Design modern UI using utility classes,https://www.google.com/search?q=tailwind%20tutorial
react,Build dynamic apps using hooks and state,https://www.google.com/search?q=react%20tutorial
angular,Learn component-based frontend architecture,https://www.google.com/search?q=angular%20tutorial
vue,Build reactive interfaces with Vue ecosystem,https://www.google.com/search?q=vue%20tutorial
next.js,Learn SSR and performance optimization,https://www.google.com/search?q=next.js%20tutorial
node.js,Build scalable backend APIs,https://www.google.com/search?q=node.js%20tutorial
express,Create REST APIs and middleware,https://www.google.com/search?q=express%20tutorial
django,Develop secure full-stack web apps,https://www.google.com/search?q=django%20tutorial
flask,Build lightweight APIs and services,https://www.google.com/search?q=flask%20tutorial
fastapi,Create high-performance APIs with Python,https://www.google.com/search?q=fastapi%20tutorial
spring,Develop enterprise Java applications,https://www.google.com/search?q=spring%20tutorial
spring boot,Build microservices with ease,https://www.google.com/search?q=spring%20boot%20tutorial
graphql,Learn flexible API querying,https://www.google.com/search?q=graphql%20tutorial
microservices,Understand distributed system design,https://www.google.com/search?q=microservices%20tutorial
sql,"""Practice joins , indexing  and optimization""",https://www.google.com/search?q=sql%20tutorial
mysql,Work on relational database design,https://www.google.com/search?q=mysql%20tutorial
postgresql,Learn advanced SQL and performance tuning,https://www.google.com/search?q=postgresql%20tutorial
mongodb,Build NoSQL-based applications,https://www.google.com/search?q=mongodb%20tutorial
redis,Use caching for performance improvement,https://www.google.com/search?q=redis%20tutorial
cassandra,Handle large-scale distributed data,https://www.google.com/search?q=cassandra%20tutorial
firebase,Build real-time apps with backend-as-a-service,https://www.google.com/search?q=firebase%20tutorial
sqlite,Use lightweight databases for apps,https://www.google.com/search?q=sqlite%20tutorial
machine learning,Work on real datasets and model building,https://www.google.com/search?q=machine%20learning%20tutorial
deep learning,Study neural networks and CNNs,https://www.google.com/search?q=deep%20learning%20tutorial
nlp,Build chatbots and text processing apps,https://www.google.com/search?q=nlp%20tutorial
computer vision,Work on image recognition projects,https://www.google.com/search?q=computer%20vision%20tutorial
data science,Analyze and visualize real-world data,https://www.google.com/search?q=data%20science%20tutorial
pandas,Manipulate and analyze datasets efficiently,https://www.google.com/search?q=pandas%20tutorial
numpy,Work with numerical computations,https://www.google.com/search?q=numpy%20tutorial
scikit-learn,Build ML models quickly,https://www.google.com/search?q=scikit-learn%20tutorial
matplotlib,Visualize data insights,https://www.google.com/search?q=matplotlib%20tutorial
seaborn,Create advanced statistical plots,https://www.google.com/search?q=seaborn%20tutorial
tensorflow,Build deep learning models,https://www.google.com/search?q=tensorflow%20tutorial
pytorch,Develop flexible neural networks,https://www.google.com/search?q=pytorch%20tutorial
xgboost,Improve model performance,https://www.google.com/search?q=xgboost%20tutorial
lightgbm,Handle large-scale ML efficiently,https://www.google.com/search?q=lightgbm%20tutorial
aws,Deploy scalable applications in cloud,https://www.google.com/search?q=aws%20tutorial
azure,Work on Microsoft cloud services,https://www.google.com/search?q=azure%20tutorial
gcp,Use Google cloud for data and apps,https://www.google.com/search?q=gcp%20tutorial
docker,Learn containerization and deployment,https://www.google.com/search?q=docker%20tutorial
kubernetes,Manage container orchestration,https://www.google.com/search?q=kubernetes%20tutorial
jenkins,Automate CI/CD pipelines,https://www.google.com/search?q=jenkins%20tutorial
github actions,Automate workflows and deployments,https://www.google.com/search?q=github%20actions%20tutorial
terraform,Manage infrastructure as code,https://www.google.com/search?q=terraform%20tutorial
ansible,Automate configuration management,https://www.google.com/search?q=ansible%20tutorial
linux,Master command line and server handling,https://www.google.com/search?q=linux%20tutorial
bash,Write shell scripts for automation,https://www.google.com/search?q=bash%20tutorial
ci/cd,Implement automated deployment pipelines,https://www.google.com/search?q=ci/cd%20tutorial
android,Build native Android applications,https://www.google.com/search?q=android%20tutorial
ios,Develop apps for Apple devices,https://www.google.com/search?q=ios%20tutorial
react native,Create cross-platform mobile apps,https://www.google.com/search?q=react%20native%20tutorial
flutter,Build fast UI apps with Dart,https://www.google.com/search?q=flutter%20tutorial
dart,Learn Flutter app development,https://www.google.com/search?q=dart%20tutorial
swift ui,Design modern iOS interfaces,https://www.google.com/search?q=swift%20ui%20tutorial
unit testing,Write tests for code reliability,https://www.google.com/search?q=unit%20testing%20tutorial
pytest,Test Python applications effectively,https://www.google.com/search?q=pytest%20tutorial
selenium,Automate browser testing,https://www.google.com/search?q=selenium%20tutorial
cypress,Perform frontend testing,https://www.google.com/search?q=cypress%20tutorial
jest,Test JavaScript applications,https://www.google.com/search?q=jest%20tutorial
mocha,Run backend JS testing,https://www.google.com/search?q=mocha%20tutorial
hadoop,Handle distributed data processing,https://www.google.com/search?q=hadoop%20tutorial
spark,Process large datasets efficiently,https://www.google.com/search?q=spark%20tutorial
kafka,Build real-time data pipelines,https://www.google.com/search?q=kafka%20tutorial
hive,Query big data using SQL-like language,https://www.google.com/search?q=hive%20tutorial
airflow,Manage data workflows,https://www.google.com/search?q=airflow%20tutorial
flink,Stream data processing,https://www.google.com/search?q=flink%20tutorial
penetration testing,Practice ethical hacking techniques,https://www.google.com/search?q=penetration%20testing%20tutorial
ethical hacking,Learn vulnerability detection,https://www.google.com/search?q=ethical%20hacking%20tutorial
network security,Secure systems and networks,https://www.google.com/search?q=network%20security%20tutorial
cryptography,Understand encryption techniques,https://www.google.com/search?q=cryptography%20tutorial
owasp,Learn web security standards,https://www.google.com/search?q=owasp%20tutorial
git,Use version control effectively,https://www.google.com/search?q=git%20tutorial
github,Collaborate on projects,https://www.google.com/search?q=github%20tutorial
gitlab,Manage CI/CD pipelines,https://www.google.com/search?q=gitlab%20tutorial
jira,Track tasks and agile workflows,https://www.google.com/search?q=jira%20tutorial
figma,Design UI/UX prototypes,https://www.google.com/search?q=figma%20tutorial
postman,Test APIs efficiently,https://www.google.com/search?q=postman%20tutorial
tableau,Create data dashboards,https://www.google.com/search?q=tableau%20tutorial
power bi,Visualize business data,https://www.google.com/search?q=power%20bi%20tutorial
communication,Improve clarity in technical discussions,https://www.google.com/search?q=communication%20tutorial
teamwork,Collaborate effectively in projects,https://www.google.com/search?q=teamwork%20tutorial
problem solving,Practice coding challenges,https://www.google.com/search?q=problem%20solving%20tutorial
leadership,Lead teams and decision-making,https://www.google.com/search?q=leadership%20tutorial
time management,Manage deadlines efficiently,https://www.google.com/search?q=time%20management%20tutorial
critical thinking,Analyze problems logically,https://www.google.com/search?q=critical%20thinking%20tutorial
adaptability,Learn new technologies quickly,https://www.google.com/search?q=adaptability%20tutorial
